{
  "$schema": "https://hyperframes.heygen.com/schema/registry-item.json",
  "name": "arc-motion-path",
  "type": "smashcut:component",
  "title": "Arc Motion Path",
  "description": "A GSAP MotionPath primitive that flies a callout along a curved arc with autorotation.",
  "tags": ["video-primitive", "motionpath", "gsap-plugin", "smashcut-native"],
  "files": [
    {
      "path": "arc-motion-path.html",
      "target": "compositions/components/arc-motion-path.html",
      "type": "smashcut:snippet"
    }
  ],
  "preview": {
    "poster": "https://static.heygen.ai/smashcut-oss/docs/images/catalog/components/arc-motion-path.png"
  }
}
