{
  "$schema": "https://hyperframes.heygen.com/schema/registry-item.json",
  "name": "code-snippet-apple-terminal-homebrew",
  "type": "smashcut:block",
  "title": "Code Snippet - Apple Terminal Homebrew",
  "description": "Apple Terminal Homebrew profile: black background with bright green text and lime cursor, per-character typing animation of a shell session.",
  "tags": ["code", "developer", "showcase", "terminal", "apple", "apple-terminal"],
  "dimensions": {
    "width": 1920,
    "height": 1080
  },
  "duration": 12,
  "files": [
    {
      "path": "code-snippet-apple-terminal-homebrew.html",
      "target": "compositions/code-snippet-apple-terminal-homebrew.html",
      "type": "smashcut:composition"
    }
  ],
  "preview": {
    "video": "https://static.heygen.ai/smashcut-oss/docs/images/catalog/blocks/code-snippet-apple-terminal-homebrew.mp4",
    "poster": "https://static.heygen.ai/smashcut-oss/docs/images/catalog/blocks/code-snippet-apple-terminal-homebrew.png"
  }
}
