{
  "$schema": "https://hyperframes.heygen.com/schema/registry-item.json",
  "name": "us-map",
  "type": "smashcut:block",
  "title": "US Map",
  "description": "Animated US choropleth map with staggered state reveals, value labels, and gradient legend — pure inline SVG with GSAP",
  "tags": ["data", "map", "geography", "usa", "choropleth"],
  "dimensions": {
    "width": 1920,
    "height": 1080
  },
  "duration": 12,
  "files": [
    {
      "path": "us-map.html",
      "target": "compositions/us-map.html",
      "type": "smashcut:composition"
    }
  ],
  "preview": {
    "video": "https://static.heygen.ai/smashcut-oss/docs/images/catalog/blocks/us-map.mp4",
    "poster": "https://static.heygen.ai/smashcut-oss/docs/images/catalog/blocks/us-map.png"
  }
}
