{
  "$schema": "https://hyperframes.heygen.com/schema/registry-item.json",
  "name": "caption-blend-difference",
  "type": "smashcut:component",
  "title": "Blend Difference",
  "description": "Auto-inverting text using mix-blend-mode: difference — flips between white and black per-pixel against the background",
  "tags": ["text", "text-effect", "effect", "blend-mode", "contrast", "inversion"],
  "files": [
    {
      "path": "caption-blend-difference.html",
      "target": "compositions/components/caption-blend-difference.html",
      "type": "smashcut:snippet"
    }
  ]
}
