{
  "$schema": "https://hyperframes.heygen.com/schema/registry-item.json",
  "name": "vpn-youtube-spot",
  "type": "smashcut:block",
  "title": "VPN YouTube Spot",
  "description": "Snappy Apple-style YouTube insert showing a phone finding and installing a friendly VPN app with sound effects.",
  "tags": ["app", "showcase", "youtube", "sfx"],
  "author": "Stronkter",
  "authorUrl": "https://x.com/Stronkter",
  "sourcePrompt": "SmashCut by HeyGen make me a 7s video with Apple-style bold font and styling: a phone scrolling in an app store, clicking on a friendly VPN app called VPN, installing it, then snapping down and fading to a white background. Make it snappy and polished for a YouTube insert, with sound effects, 60fps, and 1920x1080.",
  "dimensions": {
    "width": 1920,
    "height": 1080
  },
  "duration": 7,
  "files": [
    {
      "path": "vpn-youtube-spot.html",
      "target": "compositions/vpn-youtube-spot.html",
      "type": "smashcut:composition"
    },
    {
      "path": "assets/vpn-sfx.wav",
      "target": "assets/vpn-sfx.wav",
      "type": "smashcut:asset"
    }
  ],
  "preview": {
    "video": "https://static.heygen.ai/smashcut-oss/docs/images/catalog/blocks/vpn-youtube-spot.mp4",
    "poster": "https://static.heygen.ai/smashcut-oss/docs/images/catalog/blocks/vpn-youtube-spot.png"
  }
}
