{
  "$schema": "https://hyperframes.heygen.com/schema/registry-item.json",
  "name": "glitch",
  "type": "smashcut:block",
  "title": "Glitch",
  "description": "Shader transition with digital glitch artifacts",
  "tags": ["transition", "shader"],
  "dimensions": {
    "width": 1920,
    "height": 1080
  },
  "duration": 4,
  "files": [
    {
      "path": "glitch.html",
      "target": "compositions/glitch.html",
      "type": "smashcut:composition"
    }
  ],
  "preview": {
    "video": "https://static.heygen.ai/smashcut-oss/docs/images/catalog/blocks/glitch.mp4",
    "poster": "https://static.heygen.ai/smashcut-oss/docs/images/catalog/blocks/glitch.png"
  }
}
