{
  "$schema": "https://hyperframes.heygen.com/schema/registry-item.json",
  "name": "code-3d-extrude",
  "type": "smashcut:block",
  "title": "Code 3D Extrude",
  "description": "Syntax-highlighted code on a lit, beveled 3D slab that rotates through real space and settles to a readable rest — true WebGL depth and lighting, not a 2D transform.",
  "dimensions": {
    "width": 1920,
    "height": 1080
  },
  "duration": 8,
  "tags": ["code", "code-animation", "3d", "webgl", "developer"],
  "files": [
    {
      "path": "code-3d-extrude.html",
      "target": "compositions/code-3d-extrude.html",
      "type": "smashcut:composition"
    }
  ],
  "preview": {
    "video": "https://static.heygen.ai/smashcut-oss/docs/images/catalog/blocks/code-3d-extrude.mp4",
    "poster": "https://static.heygen.ai/smashcut-oss/docs/images/catalog/blocks/code-3d-extrude.png"
  }
}
