{
  "$schema": "https://hyperframes.heygen.com/schema/registry-item.json",
  "name": "caption-kinetic-slam",
  "type": "smashcut:component",
  "title": "Kinetic Slam",
  "description": "Full-screen single-word display with alternating entrance directions",
  "tags": ["captions", "caption-style", "kinetic", "typography", "slam"],
  "files": [
    {
      "path": "caption-kinetic-slam.html",
      "target": "compositions/components/caption-kinetic-slam.html",
      "type": "smashcut:snippet"
    }
  ],
  "preview": {
    "video": "https://static.heygen.ai/smashcut-oss/registry/components/caption-kinetic-slam/preview.mp4?v=1779051416",
    "poster": "https://static.heygen.ai/smashcut-oss/docs/images/catalog/components/caption-kinetic-slam.png"
  }
}
