{
  "$schema": "https://hyperframes.heygen.com/schema/registry-item.json",
  "name": "transitions-3d",
  "type": "smashcut:block",
  "title": "3D Transitions",
  "description": "Showcase of 3D perspective flip and rotate transitions",
  "tags": ["transition", "showcase"],
  "dimensions": {
    "width": 1920,
    "height": 1080
  },
  "duration": 11,
  "files": [
    {
      "path": "transitions-3d.html",
      "target": "compositions/transitions-3d.html",
      "type": "smashcut:composition"
    }
  ],
  "preview": {
    "video": "https://static.heygen.ai/smashcut-oss/docs/images/catalog/blocks/transitions-3d.mp4",
    "poster": "https://static.heygen.ai/smashcut-oss/docs/images/catalog/blocks/transitions-3d.png"
  }
}
