{
  "$schema": "https://hyperframes.heygen.com/schema/registry-item.json",
  "name": "caption-editorial-emphasis",
  "type": "smashcut:component",
  "title": "Editorial Emphasis",
  "description": "Dual-font system with dramatic size contrast for emphasis words",
  "tags": ["captions", "caption-style", "editorial", "typography", "emphasis"],
  "files": [
    {
      "path": "caption-editorial-emphasis.html",
      "target": "compositions/components/caption-editorial-emphasis.html",
      "type": "smashcut:snippet"
    }
  ],
  "preview": {
    "video": "https://static.heygen.ai/smashcut-oss/registry/components/caption-editorial-emphasis/preview.mp4?v=1779051416",
    "poster": "https://static.heygen.ai/smashcut-oss/docs/images/catalog/components/caption-editorial-emphasis.png"
  }
}
