{
  "$schema": "https://hyperframes.heygen.com/schema/registry-item.json",
  "name": "code-snippet-apple-terminal-red-sands",
  "type": "smashcut:block",
  "title": "Code Snippet - Apple Terminal Red Sands",
  "description": "Apple Terminal Red Sands profile: deep red background with sandy text, per-character typing animation of a shell session.",
  "tags": ["code", "developer", "showcase", "terminal", "apple", "apple-terminal"],
  "dimensions": {
    "width": 1920,
    "height": 1080
  },
  "duration": 12,
  "files": [
    {
      "path": "code-snippet-apple-terminal-red-sands.html",
      "target": "compositions/code-snippet-apple-terminal-red-sands.html",
      "type": "smashcut:composition"
    }
  ],
  "preview": {
    "video": "https://static.heygen.ai/smashcut-oss/docs/images/catalog/blocks/code-snippet-apple-terminal-red-sands.mp4",
    "poster": "https://static.heygen.ai/smashcut-oss/docs/images/catalog/blocks/code-snippet-apple-terminal-red-sands.png"
  }
}
