{
  "$schema": "https://hyperframes.heygen.com/schema/registry-item.json",
  "name": "hw-text-cloud",
  "type": "smashcut:block",
  "title": "Speech Bubble",
  "description": "Hand-drawn speech bubble with a positionable tail: outline draws on, paper fill fades in, handwritten text types per character; boils",
  "tags": ["handwritten", "speech-bubble", "overlay"],
  "dimensions": {
    "width": 1920,
    "height": 1080
  },
  "duration": 6,
  "files": [
    {
      "path": "hw-text-cloud.html",
      "target": "compositions/hw-text-cloud.html",
      "type": "smashcut:composition"
    },
    {
      "path": "assets/fonts/Caveat-700-latin.woff2",
      "target": "assets/fonts/Caveat-700-latin.woff2",
      "type": "smashcut:asset"
    }
  ]
}
